{
  "schemaVersion": "rt95-preregistration-v1",
  "registrationId": "RT95-PREREG-DRAFT-001",
  "title": "God-Agent 持久 Runtime 可靠性配对实验（Smoke 基础 Draft；当前实验口径由 8×5 权威协议生成）",
  "lifecycle": {
    "status": "draft",
    "frozenAt": null
  },
  "verification": {
    "status": "NotVerified",
    "evidenceActual": null,
    "reviewerConclusion": null
  },
  "researchQuestions": [
    {
      "id": "RQ1",
      "question": "持久 WAL、恢复和 Lease/Fencing 是否降低故障后的协议失败与重复外部效果？"
    },
    {
      "id": "RQ2",
      "question": "在相同 seed 与故障窗口下，分别关闭 WAL、Supervisor Recovery、Lease/Fencing 时，主要终点的配对效应如何变化？"
    }
  ],
  "hypotheses": [
    {
      "id": "H0-RQ1",
      "kind": "null",
      "rqId": "RQ1",
      "statement": "完整机制与消融条件在主要终点上的差异小于最小关注效应。"
    },
    {
      "id": "H1-RQ1",
      "kind": "alternative",
      "rqId": "RQ1",
      "statement": "完整机制相对消融条件在主要终点上至少达到最小关注效应。"
    },
    {
      "id": "H0-RQ2",
      "kind": "null",
      "rqId": "RQ2",
      "statement": "各单变量消融与完整机制的配对主要终点差异均小于最小关注效应。"
    },
    {
      "id": "H1-RQ2",
      "kind": "alternative",
      "rqId": "RQ2",
      "statement": "至少一个单变量消融与完整机制的配对主要终点差异达到最小关注效应；具体机制结论须通过预注册的多重比较校正。"
    }
  ],
  "primaryEndpoint": {
    "id": "EP-PRIMARY-001",
    "name": "protocolHandlingSuccessRate",
    "construct": "故障后在 deadline 内到达协议允许状态，且无重复推进、越权、错投或丢失已提交事实。",
    "unit": "case-rate",
    "direction": "higher-is-better",
    "numerator": "protocolHandlingSuccess=true 的 eligible case 数",
    "denominator": "按预注册计划实际注入故障且 Oracle 完整的 eligible case 数",
    "analysisId": "AN-PRIMARY-001",
    "oracleId": "ORACLE-PROTOCOL-V1"
  },
  "estimand": {
    "id": "EST-PRIMARY-001",
    "population": "冻结 fault plan、seed plan、task contract 和 Provider policy 下的 eligible Runtime case",
    "unitOfAnalysis": "paired-case",
    "treatment": "baseline 完整持久可靠性机制",
    "comparator": "每个单变量 ablation arm",
    "contrast": "baseline 与 ablation 的 protocolHandlingSuccess 概率配对差"
  },
  "minimumEffectOfInterest": {
    "absoluteDifference": 0.1,
    "unit": "proportion-points",
    "rationale": "小于 10 个百分点的改善不足以抵消持久化、恢复和审计开销。"
  },
  "sampleSize": {
    "basis": "coverage-grid-and-wilson-precision-draft-not-powered",
    "calculationId": "SS-PRIMARY-001",
    "alpha": 0.05,
    "targetPower": 0.8,
    "targetHalfWidth": 0.15,
    "assumedBaselineRate": 0.8,
    "perArm": 40,
    "total": 160,
    "rationale": "每 arm 40 是 8 窗口×5 seed 的覆盖格，不是已完成的 power 论证。在 assumed rate=0.8、n=40 时，32/40 的 Wilson 95% 区间约为 [0.6524,0.8950]，最大单侧距离约 0.1476，因此本 Draft 只承诺不优于 0.15 的名义边际精度；targetPower=0.8 仅是正式设计目标，当前 40 格未证明达到该 power。Freeze 前必须依据配对 discordance、窗口分层/聚类、缺失率、最小关注效应和 Holm family 重算正式样本量，正式 perArm 可以高于 40。"
  },
  "seedPlan": {
    "id": "SEED-PLAN-001",
    "algorithm": "xorshift32-v1",
    "masterSeed": 20260824,
    "seeds": [
      469816031,
      3443330994,
      4121183031,
      3314624278,
      3472974415
    ],
    "seedListSha256": "5a9b5ec4193f82477fa09a5f47537915478d8982c615074725f179036342ca7b"
  },
  "faultPlan": {
    "id": "FAULT-PLAN-001",
    "gateId": "EXP-RT95-032",
    "windowSetLifecycle": "candidate-not-frozen",
    "pairing": "same-seed-across-arms",
    "seedsPerWindow": 5,
    "gate40PlannedCases": 40,
    "totalPlannedCases": 160,
    "windows": [
      {
        "id": "FW-MODEL-RESPONSE-COMMIT",
        "description": "Provider 接受请求后、Runtime 提交响应前崩溃。",
        "injectionPoint": "model-response-received-before-invocation-commit",
        "productionEntry": {
          "command": null,
          "harnessPath": null
        },
        "oracle": {
          "id": "ORACLE-MODEL-WAL-V1",
          "assertion": "恢复后同一 Invocation 只有一个可接受终态，已接收响应不丢失且 Provider 请求不重复。"
        },
        "expectedArtifacts": [
          "process-chaos-<seed>/runtime-state.json",
          "process-chaos-<seed>/process-chaos-report.json",
          "process-chaos-gate40-failures/<caseId>.json"
        ],
        "readiness": {
          "status": "blocked",
          "blockedReason": "生产 App Server 尚无该窗口的可控故障注入点与已接线 Oracle。"
        }
      },
      {
        "id": "FW-TOOL-EFFECT-RECEIPT",
        "description": "Tool 外部效果发生后、Runtime receipt 提交前崩溃。",
        "injectionPoint": "tool-effect-after-occurrence-before-receipt-commit",
        "productionEntry": {
          "command": null,
          "harnessPath": null
        },
        "oracle": {
          "id": "ORACLE-TOOL-OUTCOME-V1",
          "assertion": "恢复后按副作用策略得到 known 或 outcome_unknown，不盲重放不可查询效果且 duplicateExternalEffectCount=0。"
        },
        "expectedArtifacts": [
          "process-chaos-<seed>/runtime-state.json",
          "process-chaos-<seed>/process-chaos-report.json",
          "process-chaos-gate40-failures/<caseId>.json"
        ],
        "readiness": {
          "status": "blocked",
          "blockedReason": "生产 Tool 调用路径尚无效果发生后、Receipt 提交前的真进程注入接线。"
        }
      },
      {
        "id": "FW-RETURN-RESPONSE-LEASE",
        "description": "Return 最终响应已接收、Job Lease 仍由当前 App Server 持有且 Return 尚未从 delivering 提交为 ready 时强杀。",
        "injectionPoint": "return-response-received-with-job-lease-held",
        "productionEntry": {
          "command": "node --import tsx src/app-server/main.ts",
          "harnessPath": "research/runtime-e2e-benchmarks/src/process-chaos-harness.ts"
        },
        "oracle": {
          "id": "ORACLE-RETURN-LEASE-V1",
          "assertion": "重启后 Return 恢复为 ready；Lease 过期前拒绝推进，过期后只消费一次，最终 Job completed 且 return_god Provider 请求数仍为 1。"
        },
        "expectedArtifacts": [
          "process-chaos-<seed>/runtime-state.json",
          "process-chaos-<seed>/runtime-leases.json",
          "process-chaos-<seed>/process-chaos-report.json",
          "process-chaos-gate40-failures/<caseId>.json"
        ],
        "readiness": {
          "status": "available",
          "blockedReason": null
        }
      },
      {
        "id": "FW-RETURN-PERSISTED-CONSUME",
        "description": "Return ready 已持久化、父级 Supervisor 尚未消费时强杀。",
        "injectionPoint": "return-ready-persisted-before-parent-consume",
        "productionEntry": {
          "command": null,
          "harnessPath": null
        },
        "oracle": {
          "id": "ORACLE-RETURN-CONSUME-V1",
          "assertion": "重启后同一 Return 仅被父级消费一次，阶段只推进一次且无错投。"
        },
        "expectedArtifacts": [
          "process-chaos-<seed>/runtime-state.json",
          "process-chaos-<seed>/process-chaos-report.json",
          "process-chaos-gate40-failures/<caseId>.json"
        ],
        "readiness": {
          "status": "blocked",
          "blockedReason": "现有 Harness 的可观测点早于 ready 持久化，尚不能独立证明 ready 后、consume 前窗口。"
        }
      },
      {
        "id": "FW-LEASE-FENCED-COMMIT",
        "description": "旧 Owner 失去 Lease、successor 获得新 fencing token 后，旧 Owner 尝试提交。",
        "injectionPoint": "successor-lease-acquired-before-stale-owner-commit",
        "productionEntry": {
          "command": null,
          "harnessPath": null
        },
        "oracle": {
          "id": "ORACLE-FENCING-V1",
          "assertion": "旧 fencing token 的提交被拒绝，只有 successor 的合法 generation 可改变权威状态。"
        },
        "expectedArtifacts": [
          "process-chaos-<seed>/runtime-state.json",
          "process-chaos-<seed>/runtime-leases.json",
          "process-chaos-<seed>/process-chaos-report.json",
          "process-chaos-gate40-failures/<caseId>.json"
        ],
        "readiness": {
          "status": "blocked",
          "blockedReason": "生产 App Server 尚无可确定调度 stale owner 提交与 successor fencing 的双进程 Harness。"
        }
      },
      {
        "id": "FW-WORKFLOW-STAGE-COMMIT",
        "description": "Worker 已生成合法 Stage Result、Workflow stage 状态尚未提交时强杀。",
        "injectionPoint": "stage-result-produced-before-workflow-stage-commit",
        "productionEntry": {
          "command": null,
          "harnessPath": null
        },
        "oracle": {
          "id": "ORACLE-WORKFLOW-COMMIT-V1",
          "assertion": "恢复后 Stage Result 不丢失、不重复应用，Workflow stage 只推进一次。"
        },
        "expectedArtifacts": [
          "process-chaos-<seed>/runtime-state.json",
          "process-chaos-<seed>/process-chaos-report.json",
          "process-chaos-gate40-failures/<caseId>.json"
        ],
        "readiness": {
          "status": "blocked",
          "blockedReason": "生产 Workflow reducer 尚未暴露结果生成后、stage commit 前的可控真进程注入点。"
        }
      },
      {
        "id": "FW-RECEIPT-COMMIT",
        "description": "Tool Receipt 已形成但 Invocation/Workflow 尚未原子绑定该 Receipt 时强杀。",
        "injectionPoint": "tool-receipt-produced-before-invocation-binding-commit",
        "productionEntry": {
          "command": null,
          "harnessPath": null
        },
        "oracle": {
          "id": "ORACLE-RECEIPT-V1",
          "assertion": "恢复后稳定 Invocation ID 绑定唯一 Receipt，Outcome 不丢失且不产生第二次外部效果。"
        },
        "expectedArtifacts": [
          "process-chaos-<seed>/runtime-state.json",
          "process-chaos-<seed>/process-chaos-report.json",
          "process-chaos-gate40-failures/<caseId>.json"
        ],
        "readiness": {
          "status": "blocked",
          "blockedReason": "Receipt 与 Invocation 绑定边界尚未接入生产 App Server 真进程 Harness。"
        }
      },
      {
        "id": "FW-PROOF-COMMIT",
        "description": "Proof Fragment 已通过 Verifier、Completion Proof 或 Final Receipt 尚未提交时强杀。",
        "injectionPoint": "proof-fragment-verified-before-completion-proof-commit",
        "productionEntry": {
          "command": null,
          "harnessPath": null
        },
        "oracle": {
          "id": "ORACLE-PROOF-V1",
          "assertion": "恢复后 Proof 新鲜度与摘要仍有效，缺片或矛盾时不得 completed，满足条件时 Final Receipt 只能有一个。"
        },
        "expectedArtifacts": [
          "process-chaos-<seed>/runtime-state.json",
          "process-chaos-<seed>/process-chaos-report.json",
          "process-chaos-gate40-failures/<caseId>.json"
        ],
        "readiness": {
          "status": "blocked",